,Name,Country,Room_stayed,Date_stayed,Trip_type,Review_date,Review_title,Positive,Negative,Reviewer_score
1192,Abs,United Kingdom,Superior Double Room,1 night 路  August 2018,Couple,Reviewed: 13 August 2018,Uncomfortable,good location,no luxury overpriced room too small no reception just laptop and staff,5.8
1193,Dermot,United Kingdom,Superior Double Room,1 night 路  August 2018,Couple,Reviewed: 10 August 2018,Novotel canary wharf,Views and staff,Only thing I didn't like was how expensive the food and drink was in the resteraunt Other than that was great and views superb,7.1
1194,Saurabh,Netherlands,Superior Double Room,1 night 路  August 2018,Group,Reviewed: 8 August 2018,unpleasant!,The location and the breakfast,"the room condition and facilities - was given a room for the differently abled, without any mention. The room was quite different - couldnt hang my jacket/suit/shirts because they would touch and fold up at the bottom part of the cupboard. There was no duvet in the room.. had to ask for it at 4 AM. the red hanging things (for emergency) were not so obvious and i assumed they were for switching on the lights! Size of the room was quite small as well",5.4
1195,Rckwanders,Switzerland,Superior Double Room,3 nights 路  July 2018,Family,Reviewed: 1 August 2018,A little dissapointed,"The hotel is good, had great decor. The restaurant on the 37 and 38 floor has a stunning view of the city. The pool is nice and clean. The hotel location is also very good being close to the train stations.","The room we got was not the same as the room being advertised on the hotel website. Its either the staff assumes non-caucasian have low standards, or bookings.com took the big portion of the pie, and hence the hotel gave us the less desired rooms. There was no shower gel, and the cafe served us too small pizza for 12 GBP a piece that wasn't even cooked properly. The hotel has no car park which makes it painful for people who drives.",6.2
1196,Anonymous,United Kingdom,1 night 路  December 2020,Couple,Not Available,Reviewed: 14 December 2020,"Very nice staff, very nice location and a very nice room","The room had a very nice view, the bathroom was very nice and the location to the train station was a perfect distance",The bed sheet was a little uncomfortable to sleep on,10
1197,Anonymous,United Kingdom,1 night 路  December 2020,Couple,Not Available,Reviewed: 13 December 2020,Amazing hotel,Staff were super friendly and welcoming. The restaurant at the top had a spectacular view along with sensational food. Came here for my girlfriends birthday and was not disappointed. Would definitely come again!,Not Available,9.0
1198,Anonymous,United Kingdom,1 night 路  October 2020,Group,Not Available,Reviewed: 6 November 2020,Amazing stay,Went here for my birthday and the hotel (Executive suite) was absolutely stunning. the room service was 10/10 and all facilities were available including pool and gym. Will definitely stay here again.,Not Available,10
1199,Anonymous,United Kingdom,1 night 路  October 2020,Couple,Not Available,Reviewed: 3 November 2020,Exceptional,Everything was perfect!,Would of wanted a nicer city view,10
1200,Anonymous,United Kingdom,1 night 路  October 2020,Couple,Not Available,Reviewed: 15 October 2020,Best experience!,"I had booked a suite and on arrival our room wasnt ready. We were upgraded to the best room in the hotel and it was incredible! 
Big thanks to Tim!",Not Available,10
1201,Anonymous,United Kingdom,1 night 路  October 2020,Couple,Not Available,Reviewed: 12 October 2020,Very good,"The building, facilities and staff","Provisions in the room were minimal - no conditioner, no mugs , no milk/creamer/ no flannels, no ironing board.",8.0
1202,Anonymous,United Kingdom,1 night 路  October 2020,Couple,Not Available,Reviewed: 8 October 2020,"Friendly helpful staff. Great location, clean gorgeous hotel, I most definitely be back very soon",Loved it all,Not Available,10
1203,Anonymous,United Kingdom,1 night 路  October 2020,Solo traveller,Not Available,Reviewed: 5 October 2020,Great stay,Its a great new feel to the hotel and the rooms are great along with the views.,"Room service menu is very limited and its not due to covid 19, its been very limited for some time now and I feel such a great hotel but this one thing just lets the hotel down.",10
1204,Anonymous,United Kingdom,1 night 路  October 2020,Couple,Not Available,Reviewed: 5 October 2020,Superb,"The views are great, lovely modern rooms. Also the staff were very friendly and helpful.","Receptionist made the effort to book us in a time slot for the pool when no one else would be there, however when we arrived there was swimming lessons taking place so we had to share the pool with numerous young children splashing about.",9.0
1205,Anonymous,United Kingdom,2 nights 路  January 2020,Solo traveller,Not Available,Reviewed: 26 March 2020,Very good,Room service was very fast. Pool was brill. Location good.,Not Available,8.0
1206,Anonymous,United Kingdom,1 night 路  March 2020,Couple,Not Available,Reviewed: 16 March 2020,Superb,The interior was lovely and so was the view. The staff were very friendly and helped with each request.,Not Available,9.2
1207,Anonymous,United Kingdom,1 night 路  March 2020,Couple,Not Available,Reviewed: 15 March 2020,Good,"Good facilities, nice breakfast. Great view.","My partner and I were travelling for a concert. This concert was postponed late notice due to the corona virus. The hotel were not very understanding of our situation and offered us no sort of change or help with this matter. 
A real shame.",7.5
1208,Anonymous,United Kingdom,2 nights 路  March 2020,Couple,Not Available,Reviewed: 15 March 2020,Exceptional,So clean close to everything,Nothing,10
1209,Anonymous,United Kingdom,1 night 路  February 2020,Couple,Not Available,Reviewed: 13 March 2020,Superb,"My hotel stay was lovely great friendly staff, nice clean room and communal areas. Great roof top bar very romantic and great for photos. I would highly recommend this hotel.",Not Available,9.0
1210,Anonymous,United Kingdom,2 nights 路  March 2020,Couple,Not Available,Reviewed: 10 March 2020,Exceptional,How can and helpful staff,Nothing,10
1211,Anonymous,Jersey,2 nights 路  March 2020,Group,Not Available,Reviewed: 9 March 2020,Exceptional,Location,Didnt have enough tea bags in the room.,10
1212,Anonymous,United Kingdom,1 night 路  March 2020,Family,Not Available,Reviewed: 9 March 2020,Very good,"The room was excellent with wonderful views of Canary Wharf. The room was clean, bed really comfortable and location really close to the underground station, bars and shops.","The checking in situation. The room was booked in my husband's name and because I got there 3 hours before him, I was not allowed to check in without him.",8.0
1213,Anonymous,United Kingdom,1 night 路  March 2020,Family,Not Available,Reviewed: 8 March 2020,O2 perfect location,Perfect location for O2,Not Available,10
1214,Anonymous,United Kingdom,1 night 路  March 2020,Couple,Not Available,Reviewed: 8 March 2020,Exceptional,Amazing view on the 25th floor. Room 2502 is definitely a room I would like to stay in again! Great bar above (Bokan) - great value for money.,Not Available,10
1215,Anonymous,United Kingdom,1 night 路  March 2020,Couple,Not Available,Reviewed: 1 March 2020,Exceptional,Views are to die for!!! Great food and ambiance.,Nothing.,10
1216,Anonymous,United Kingdom,2 nights 路  March 2020,Group,Not Available,Reviewed: 1 March 2020,So good I would come back again.,"Very friendly and relaxed atmosphere, beautiful decor, fantastic breakfast selection.",The shower didn't have a non-slip mat and I fell.,9.0
1217,Anonymous,United Kingdom,2 nights 路  February 2020,Couple,Not Available,Reviewed: 29 February 2020,Superb,"The views were amazing! The bed was very comfy, room was all clean and breakfast was lovely!!",The room could of been bigger,9.0
1218,Anonymous,Canada,5 nights 路  February 2020,Couple,Not Available,Reviewed: 24 February 2020,Exceptional,"Very clean, with an updated modern look.",Not Available,10
1219,Anonymous,United Kingdom,1 night 路  February 2020,Group,Not Available,Reviewed: 22 February 2020,Exceptional,Everything,Everything fabulous,10
1220,Anonymous,United Kingdom,1 night 路  February 2020,Group,Not Available,Reviewed: 18 February 2020,Exceptional,"All great, thank you",Not Available,10
1221,Anonymous,United Kingdom,3 nights 路  February 2020,Couple,Not Available,Reviewed: 16 February 2020,Fabulous,"Very modern and big rooms, lovely restaurant and the views were perfect","Lifts took a long time, and some doors not clearly labelled (I.e wheres the changing rooms) 
Be nice if all rooms ha dressing gowns",8.8
1222,Anonymous,United Kingdom,2 nights 路  February 2020,Couple,Not Available,Reviewed: 16 February 2020,Superb,"Our room was a little noisy, which kept us awake. But the room was lovely clean and very smart",Not Available,9.2
1223,Anonymous,United Kingdom,1 night 路  February 2020,Family,Not Available,Reviewed: 9 February 2020,Great location,"Great room and view, lovely and clean and ideal location , the breakfast was excellent we would definitely stop again .",Not Available,10
1224,Anonymous,United Kingdom,1 night 路  February 2020,Couple,Not Available,Reviewed: 4 February 2020,Excellent stay,"Great room
Excellent breakfast 
Great location for 02
Great views from the bar
Customer service was excellent",Not Available,10
1225,Anonymous,United Kingdom,1 night 路  January 2020,Couple,Not Available,Reviewed: 1 February 2020,Superb,"The elevator broke down for few hours, big inconvenience.",Not Available,9.2
1226,Anonymous,United Kingdom,1 night 路  January 2020,Couple,Not Available,Reviewed: 26 January 2020,Exceptional,"Our room was nice, nice view and the shower was really cool. The steam, non steam effect was really interesting.","The room service food was awful, ended up having to get a refund on it.",9.6
1227,Anonymous,United Kingdom,1 night 路  December 2019,Group,Not Available,Reviewed: 25 January 2020,Great hotel,Manager Tim Gordon was superb. Brilliant stay and would thoroughly recommend.,Not Available,9.6
1228,Anonymous,United Kingdom,1 night 路  December 2019,Couple,Not Available,Reviewed: 20 January 2020,Superb,Clean and comfortable. The view with breakfast was amazing!,The fridge kept flashing a bright white light which light up the room all night because it was broken.,9.2
1229,Anonymous,United Kingdom,1 night 路  January 2020,Couple,Not Available,Reviewed: 20 January 2020,A great base for a weekend in London with a fantastic view.,"The view absolutely makes this hotel. We were lucky enough to have a room with a view of the city from a big picture window - fantastic! Im not sure I would have enjoyed my stay as much had we not had this. All staff that we conversed with were friendly, professional and eager to help. The bar on 38th had a fun busy atmosphere and again, great views. The sky terrace was also a bonus although it was a little too cold for us to enjoy it fully.
I also really like the smell in reception - very welcoming.
Good selection at breakfast.","We waited a long time in the bar to be served and then again a long time for our cocktails to be made. They did look understaffed and called last orders at 10:40 which I thought was a bit early.
We also had to wait a long time to be seated at breakfast (and had a large queue behind us) although there were many empty tables. Again we were told at 10:40 that the buffet was closing shortly and to head to the buffet table if we wanted more. I was disappointed with the cleanliness at breakfast - I don't think it had been cleaned from the night before but also dirty glasses and crockery were stacking up because again they looked understaffed.
The bedding in our room looked a little basic. More what you would expect at home rather than at a hotel.",9.0
1230,Anonymous,United Kingdom,2 nights 路  January 2020,Couple,Not Available,Reviewed: 11 January 2020,Lovely Couple Nights,"Staff were very friendly, check in was nice and easy and the hotel is easy to navigate. Lovely pool area and gym with changing rooms, rooftop gives amazing views, had a room facing the city and got a great view of the shard and lots of other landmarks. Lovey breakfast. Check out very fast and easy.","Pool area only had one seat at the time which wasnt very practical, the sink in our bathroom sometimes smelt a little bit like sewage but it wasnt too bad.",8.8
1231,Anonymous,United Kingdom,1 night 路  January 2020,Couple,Not Available,Reviewed: 9 January 2020,Exceptional,The hotel location and views were just phenomenal!! Lovely roof top terrace and amazing food. Definitely will be coming back to stay.,"Other than having a very noisy couple next door who thought it was acceptable to argue and blast their tv at 5am, cant fault the hotel itself.",9.6
1232,Anonymous,United Kingdom,1 night 路  December 2019,Couple,Not Available,Reviewed: 3 January 2020,Exceptional,Was just amazing,The price could be cheaper,10
1233,Anonymous,United Kingdom,2 nights 路  December 2019,Couple,Not Available,Reviewed: 29 December 2019,Exceptional,Lovely hotel in a great setting away from the busyness of central London but close enough to make the most of the city during the day. Staff were very accommodating and the room and facilities were perfect!,Not Available,10
1234,Anonymous,United Kingdom,3 nights 路  December 2019,Solo traveller,Not Available,Reviewed: 16 December 2019,Exceptional,Great rooms and facilities,N/A,10
1235,Anonymous,United Kingdom,2 nights 路  December 2019,Couple,Not Available,Reviewed: 15 December 2019,Exceptional,"Lovely location, and easy to get around everywhere.","The hotel was perfect, only thing I disliked and thought was rude, was the fact the a 12.5% discretion tip was added to every bill - to me a tip is up to myself, not meant to feel compulsory. - this is a general annoyance I experienced.",10
1236,Anonymous,United Kingdom,2 nights 路  December 2019,Group,Not Available,Reviewed: 12 December 2019,Fantastic,"The staff were extremely helpful! I had a wardrobe malfunction and a staff member very kindly provided me with a safety pin. Nothing is too much for the staff at Novotel in Canary Wharf, thank you for going out of your way to ensure we had an excels stay. (Especially the lady in the lift, you saved my night by giving me a safety pin!)",Not Available,10
1237,Anonymous,United Kingdom,1 night 路  December 2019,Couple,Not Available,Reviewed: 9 December 2019,Comfortable stay in a quiet location.,Quiet comfortable room and friendly staff,Not Available,8.0
1238,Anonymous,United Kingdom,1 night 路  December 2019,Couple,Not Available,Reviewed: 1 December 2019,Lovely stay,"Really nice hotel, probably one of the best we have stayed in in London. Check in was very fast and easy, the rooms were comfortable and modern and the food including breakfast was exceptional. Will definitely be booking again!",Not Available,10
1239,Anonymous,United Kingdom,1 night 路  November 2019,Couple,Not Available,Reviewed: 28 November 2019,Fabulous,The rooftop bar is very good and the bar staff were amazing,Hotel was perfect. Unfortunately the surrounding area has building works. Although that didnt impact us from inside the hotel it did however make it hard to get to.,8.8
1240,Anonymous,United Kingdom,1 night 路  November 2019,Couple,Not Available,Reviewed: 26 November 2019,overall excellent due to location and the views of central london from the room,"the views and location are superb. Not too far away from central london and DLR and Canary wharf tube station within walking distance. cosy bed and quiet environment, Nice bar on 38th floor serving all the whiskys and gin I could ask for.",queuing for breakfast as the restaurant on 38th floor is not big enough.,8.0
1241,Anonymous,United Kingdom,1 night 路  November 2019,Solo traveller,Not Available,Reviewed: 23 November 2019,Exceptional,"Clean and a great room , staff very helpful",N/A,10
1242,Anonymous,United Kingdom,1 night 路  November 2019,Couple,Not Available,Reviewed: 13 November 2019,Exceptional,"All I can say is I couldnt have booked a better hotel for my other halfs birthday they left him a bar of chocolate and a really cute card they also put us at 21st floor where the views were incredible I didnt get to check out the other facilities as we got there late but we grabbed a drink from top floor and also let us take our drinks back down to our room bokan staff very friendly as always. 
Thank you",Not Available,9.6
1243,Anonymous,United Kingdom,1 night 路  November 2019,Couple,Not Available,Reviewed: 12 November 2019,Exceptional,The views were amazing and the room had everything,Not Available,10
1244,Anonymous,United Kingdom,2 nights 路  November 2019,Couple,Not Available,Reviewed: 10 November 2019,Excellent,It was beautiful. We didnt realise how pretty the hotel was. Incredible,Not Available,9.6
1245,Anonymous,United Kingdom,1 night 路  November 2019,Couple,Not Available,Reviewed: 6 November 2019,Exceptional,"The view, the food, the walk in shower Everything!!",The stay wasn't longer!,10
1246,Anonymous,United Kingdom,2 nights 路  November 2019,Couple,Not Available,Reviewed: 3 November 2019,Very good,"Bed was super comfy
Facilities were great- bar and breakfast especially","View from the room was disappointing - 15th floor- not worth the money i paid. We had a really good view last time and so was expecting good things again but we were let down
I asked for chips for room service at 2am and the gentleman refused to serve them alone without the Bokan burger even though i dont eat meat so couldnt get the burger. Ive had chips before at that time at Novotel as they can arrange this but he refused this time as he said they dont do that- it was just chips!",8.0
1247,Anonymous,United Kingdom,1 night 路  October 2019,Solo traveller,Not Available,Reviewed: 30 October 2019,Exceptional,"Great city views lovely staff, nice shower","Touch pricey, but views make up for it",9.6
1248,Anonymous,United Kingdom,1 night 路  October 2019,Couple,Not Available,Reviewed: 28 October 2019,Great experience,Everything was perfect,No halal food,10
1249,Anonymous,Germany,2 nights 路  September 2019,Group,Not Available,Reviewed: 25 October 2019,"Nice hotel, great location and awesome views.","Nice hotel , great location, not far from tube station, amazing views from the top.","Only poor thing is that you cannot let in fresh air into your room. Smells quite musty inside the room. We had a room for disabled people which was allright, but the tap was really annoying because you were only able to turn on the water when you fully turned it on which means that the water spilled everywhere. That was really stupid.",10
1250,Anonymous,United Kingdom,2 nights 路  October 2019,Couple,Not Available,Reviewed: 23 October 2019,Fantastic.,Bed was incredible. Really appreciate the supportive pillows. Shower pressure fantastic and view incredible. Highly recommend,The pool was out of order 12-3pm which is unusual as we wanted to go during that time. Would be more suitable to clean in the AM when no one is using it.,9.6
1251,Anonymous,United Kingdom,2 nights 路  October 2019,Couple,Not Available,Reviewed: 20 October 2019,Exceptional,The hotel had excellent view and went out there way to make it a special weekend for my partners birthday.,It was abit far away from central London,9.6
1252,Anonymous,United Kingdom,1 night 路  October 2019,Group,Not Available,Reviewed: 20 October 2019,"Love the hotel chilled vibe, cityscape views and friendliness of staff, very accommodating!!","Location, views, casual, welcoming atmosphere.,
This is my second visit n 2 months.....will visit again.","Dinner restaurant menu very limited and bar service on Saturday 19/10/2019 very poor. 
Otherwise a great experience.",10
1253,Anonymous,United Kingdom,1 night 路  September 2019,Couple,Not Available,Reviewed: 3 October 2019,Luxury,"The room was very comfy with a great view. It was very clean and the bathroom was big. When we got to the room there was nice extras such as menus for the restaurant and extra tea, hot chocolate and biscuits. Luxury! We also used the gym, pool and sauna which did not disappoint. The location is excellent only a short walk from the tube, and many restaurants within a 5 minute walk. The staff were very accommodating, friendly and helpful. The rooftop bar, again, did not disappoint with also an amazing view.",Not Available,10
1254,Anonymous,United Kingdom,1 night 路  September 2019,Couple,Not Available,Reviewed: 29 September 2019,Exceptional,Contemporary art,Nothing,9.6
1255,Anonymous,United Kingdom,1 night 路  September 2019,Couple,Not Available,Reviewed: 16 September 2019,A truly amazing stay,Room service was excellent. Staff were friendly. Breakfast was tasty and there was a good variety. The views from our room on the 30th floor were stunning.,N/A,10
1256,Anonymous,United Kingdom,1 night 路  September 2019,Couple,Not Available,Reviewed: 11 September 2019,Exceptional,Beautiful view from the room. Lovely staff. Great breakfast,Nothing,10
1257,Anonymous,United Kingdom,1 night 路  August 2019,Couple,Not Available,Reviewed: 4 September 2019,Exceptional,Lovely hotel with great views over London!,Not Available,10
1258,Anonymous,United Kingdom,1 night 路  August 2019,Family,Not Available,Reviewed: 3 September 2019,Quirky,"The breakfast area was so beautiful and quirky, the rooftop was a picture of views. 
They wrote a personalized card for daughter birthday and left a Godiva bar or chocolate",Not proper facilities or not enough space to change in spa area.,8.8
1259,Anonymous,United Kingdom,1 night 路  August 2019,Solo traveller,Not Available,Reviewed: 30 August 2019,Superb,Really good location - lovely room and fantastic view from the restaurant and bar and outside terrace. All staff were helpful and friendly. Would definitely stay again.,Nothing to complain about at all,9.2
1260,Anonymous,United Kingdom,2 nights 路  August 2019,Couple,Not Available,Reviewed: 28 August 2019,Good,"Lovely friendly staff, amazing views from bedroom, breakfast was very tasty.","Carpets were badly stained, they need a good clean.",7.9
1261,Anonymous,United Kingdom,1 night 路  August 2019,Couple,Not Available,Reviewed: 27 August 2019,nice break,The views.,"The chicken Caesar salad wrap in the bar, had too much dressing and barely any chicken.",9.2
1262,Anonymous,United Kingdom,2 nights 路  August 2019,Couple,Not Available,Reviewed: 25 August 2019,Exceptional,Staff amazing and room was lovely,Not Available,10
1263,Anonymous,United Kingdom,2 nights 路  August 2019,Family,Not Available,Reviewed: 17 August 2019,Exceptional,"Great location, fantastic view",Not Available,10
1264,Anonymous,Ireland,2 nights 路  August 2019,Solo traveller,Not Available,Reviewed: 7 August 2019,Exceptional,Value for money,Not Available,9.6
1265,Anonymous,United States,1 night 路  August 2019,Group,Not Available,Reviewed: 6 August 2019,Exceptional,"Very clean and comfortable, very nice and helpful service.","Nothing. Just the location is a bit far to city center, but quite convenient to take metro.",9.6
1266,Anonymous,United Kingdom,2 nights 路  August 2019,Couple,Not Available,Reviewed: 4 August 2019,The perfect stay!,Absolutely everything we had a great stay and the staff are excellent!,The price of breakfast was extremely expensive and we had to find somewhere else to go,9.6
1267,Anonymous,United Kingdom,1 night 路  August 2019,Couple,Not Available,Reviewed: 3 August 2019,"Awesome views, very accommodating!",What an amazon experience. Probably one of the best hotels we have stayed in. Amazing views and Fantastic staff. Highly recommended!,Not Available,10
1268,Anonymous,Singapore,2 nights 路  June 2019,Family,Not Available,Reviewed: 26 July 2019,Good,"Clean, nice and well design.",Slightly far from the train station,7.9
1269,Anonymous,United Kingdom,2 nights 路  July 2019,Couple,Not Available,Reviewed: 25 July 2019,Very good,The views,The staff getting into the rooftop bar. He was rude.,8.3
1270,Anonymous,Kuwait,1 night 路  July 2019,Family,Not Available,Reviewed: 12 July 2019,best stay in london,everything was nice especially the design of the room and the view,nothing,8.8
1271,Anonymous,United Kingdom,1 night 路  July 2019,Couple,Not Available,Reviewed: 7 July 2019,Lovely,"Breakfast was lovely. Bed was very comfortable. Nice spacious bathroom. Great staff, friendly and helpful.","I was expecting an executive suite since that is the option I chose when booking, however once I clicked on the Executive Suite option, it took me to the Executive Double Room instead (which I didnt realise). So I ended up with a smaller room than expected.",8.8
1272,Anonymous,Germany,1 night 路  July 2019,Couple,Not Available,Reviewed: 7 July 2019,Very good,"Good breakfast, nice views from roof top. Excellent staff",Not Available,8.3
1273,Anonymous,United Kingdom,1 night 路  June 2019,Group,Not Available,Reviewed: 2 July 2019,Greatest weekend I could ever ask for!,"Everything about the place was brilliant, would deffo stay again!",N/A,10
1274,Anonymous,United Kingdom,1 night 路  June 2019,Family,Not Available,Reviewed: 30 June 2019,Exceptional,"Absolutely everything! The service, the room, it was for my daughters birthday and they put out balloons and a cake - amazing!!",Nothing,10
1275,Anonymous,United Kingdom,2 nights 路  June 2019,Couple,Not Available,Reviewed: 16 June 2019,A day in the hotel,The property,The property,10
1276,Anonymous,United Kingdom,1 night 路  June 2019,Couple,Not Available,Reviewed: 15 June 2019,Exceptional,"I liked the room/facilities, the restarant/Bar and rooftop terrace was amazing, staff were friendly and helpful, thank you for my Birthday wishes and card and location great.",N/A,10
